[
  {
    "turn_id": 1,
    "question": "请介绍一个你最有成就感的项目，并说明你本人的贡献。",
    "targets": [
      "成果证据",
      "结构化表达"
    ],
    "answer": "我在实习时负责订单查询接口的优化。当时的背景是接口平均响应 800ms，用户投诉集中在列表加载慢。我的任务是定位瓶颈并提出优化方案。我通过慢查询日志发现是索引缺失，于是加了复合索引，并引入 Redis 缓存热点数据。最终平均响应降到 220ms。",
    "answer_quote": "最终平均响应降到 220ms",
    "missing_elements": [],
    "follow_up": {
      "question": "你提到引入 Redis 缓存热点数据，缓存与数据库的一致性是怎么保证的？",
      "reason": "回答中提到了缓存方案但未说明一致性策略，属于 action 深度追问"
    },
    "asr_confidence": null,
    "subscores": {
      "structure": 85,
      "relevance": 88,
      "specificity": 82,
      "followup_adaptation": 70,
      "clarity": 84
    }
  },
  {
    "turn_id": 2,
    "question": "讲讲你在团队中和他人发生分歧的一次经历。",
    "targets": [
      "协作沟通",
      "冲突处理"
    ],
    "answer": "有一次讨论库存扣减方案，同学主张直接数据库乐观锁，我认为高并发下应该用分布式锁。我们各自做了压测对比，最后结合两种方案：常态用乐观锁，秒杀场景切分布式锁。",
    "answer_quote": "常态用乐观锁，秒杀场景切分布式锁",
    "missing_elements": [
      "metric"
    ],
    "follow_up": {
      "question": "你提到做了压测对比，具体的 QPS 数据还记得吗？",
      "reason": "回答缺少 metric 维度，追问量化证据"
    },
    "asr_confidence": null,
    "subscores": {
      "structure": 72,
      "relevance": 78,
      "specificity": 60,
      "followup_adaptation": 75,
      "clarity": 70
    }
  },
  {
    "turn_id": 3,
    "question": "如果这个岗位需要你在一个月内上手不熟悉的技术栈，你会怎么做？",
    "targets": [
      "学习能力",
      "岗位适配"
    ],
    "answer": "我会先读官方文档的 Quickstart，然后找一个最小可运行示例跑通，再对照项目代码梳理调用链。之前学 Go 时我就是用这个方法，两周内能独立写接口。",
    "answer_quote": "两周内能独立写接口",
    "missing_elements": [
      "result"
    ],
    "follow_up": null,
    "asr_confidence": null,
    "subscores": {
      "structure": 70,
      "relevance": 82,
      "specificity": 65,
      "followup_adaptation": 72,
      "clarity": 74
    }
  }
]